{
  "$schema": "http://json-schema.org/draft-07/schema#",
  "title": "Claudearium Profile",
  "description": "Declarative spec for claudearium. Edit and run 'reconcile' to bring the sandbox into the described state.",
  "type": "object",
  "required": ["schemaVersion", "distro"],
  "additionalProperties": false,
  "properties": {
    "schemaVersion": {
      "const": 1
    },
    "distro": {
      "type": "object",
      "required": ["name", "base", "installPath"],
      "additionalProperties": false,
      "properties": {
        "name":        { "type": "string", "minLength": 1, "pattern": "^[A-Za-z0-9._-]+$" },
        "base":        { "type": "string", "enum": ["debian-12"] },
        "installPath": { "type": "string", "minLength": 1 }
      }
    },
    "vpn": {
      "type": "object",
      "additionalProperties": false,
      "properties": {
        "wgConfigPath": { "type": ["string", "null"] },
        "killswitch":   { "type": "boolean" },
        "routingMode":  { "type": "string", "enum": ["from-config", "all-except-lan"] },
        "lanCidr":      { "type": ["string", "null"], "pattern": "^(25[0-5]|2[0-4][0-9]|1[0-9][0-9]|[1-9]?[0-9])(\\.(25[0-5]|2[0-4][0-9]|1[0-9][0-9]|[1-9]?[0-9])){3}/(3[0-2]|[12]?[0-9])$" }
      },
      "allOf": [
        {
          "if":   { "properties": { "routingMode": { "const": "all-except-lan" } }, "required": ["routingMode"] },
          "then": { "properties": { "lanCidr": { "not": { "const": "0.0.0.0/0" } } } }
        }
      ]
    },
    "tools": {
      "type": "object",
      "additionalProperties": {
        "type": "object",
        "additionalProperties": false,
        "properties": {
          "enabled": { "type": "boolean" },
          "version": { "type": "string" }
        }
      }
    },
    "projects": {
      "description": "Each entry describes one git repository. distroProjects (default) live as bare mirrors inside the distro and sessions are distro-side worktrees. hostProjects (type='host') use a Windows-side checkout; sessions are host-side worktrees mounted into the distro and tools like pwsh/git are wrapped from the host via a per-session PATH shim. See docs/sessions.md.",
      "type": "array",
      "items": {
        "type": "object",
        "required": ["name"],
        "additionalProperties": true,
        "properties": {
          "name":          { "type": "string", "pattern": "^[A-Za-z0-9._-]+$" },
          "enabled":       { "type": "boolean", "default": true, "description": "When false, reconcile tears down the project's infrastructure (mirror or per-project bin dir + all sessions) but preserves the profile entry. Re-enable to recreate everything." },
          "type":          { "type": "string", "enum": ["distro", "host"], "default": "distro" },
          "remote":        { "type": "string", "minLength": 1 },
          "hostCheckout":  { "type": "string", "minLength": 1, "description": "Required when type='host'. Windows path to the user's main checkout; session worktrees land at '<hostCheckout>-sessions/<session>'." },
          "hostShadows":   {
            "type": "array",
            "description": "Tools (e.g. 'pwsh', 'git') to wrap from the Windows host into a per-project bin dir that's prepended to PATH only for sessions of this hostProject. Names are resolved via 'where.exe <tool>.exe' first, then a built-in candidate list. Use the object form to pin a specific Windows .exe.",
            "items": {
              "oneOf": [
                { "type": "string", "minLength": 1 },
                {
                  "type": "object",
                  "required": ["name", "windowsExe"],
                  "additionalProperties": false,
                  "properties": {
                    "name":       { "type": "string", "pattern": "^[A-Za-z0-9._-]+$" },
                    "windowsExe": { "type": "string", "minLength": 1 }
                  }
                }
              ]
            }
          },
          "defaultBranch": { "type": "string" },
          "tabColor":      { "type": ["string", "null"], "pattern": "^(#[0-9A-Fa-f]{6})?$" },
          "icon":          { "type": ["string", "null"], "description": "Windows Terminal tab icon for this project's sessions: a file path, emoji, 'ms-appdata:///...' reference, or built-in glyph. Stored verbatim and emitted into a generated WT profile fragment (icon/backgroundImage need a WT profile; wt.exe has no CLI flag for them)." },
          "backgroundImage": { "type": ["string", "null"], "description": "Windows Terminal background image for this project's sessions: a Windows file path, URL, or the literal 'desktopWallpaper'. Stored verbatim and emitted into the generated WT profile fragment." },
          "backgroundImageOpacity": { "type": ["integer", "null"], "minimum": 0, "maximum": 100, "description": "Opacity percent of the background image: 0 = fully transparent, 100 = solid. Overrides projectDefaults.backgroundImageOpacity. Only meaningful alongside backgroundImage." },
          "hostMounts":    { "$ref": "#/properties/hostMounts" },
          "hostTools":     { "$ref": "#/properties/hostTools" },
          "claudeSettings":{ "$ref": "#/properties/claudeSettings" }
        },
        "allOf": [
          {
            "if":   { "properties": { "type": { "const": "host" } }, "required": ["type"] },
            "then": { "required": ["hostCheckout"], "properties": { "hostTools": { "maxItems": 0 } } }
          },
          {
            "if":   { "not": { "properties": { "type": { "const": "host" } }, "required": ["type"] } },
            "then": { "required": ["remote"] }
          }
        ]
      }
    },
    "projectDefaults": {
      "type": "object",
      "description": "Default values applied to every project unless the project overrides them.",
      "additionalProperties": false,
      "properties": {
        "backgroundImageOpacity": { "type": "integer", "minimum": 0, "maximum": 100, "default": 100, "description": "Default background-image opacity percent (0 = fully transparent, 100 = solid) for projects that set a backgroundImage but no per-project backgroundImageOpacity." }
      }
    },
    "hostMounts": {
      "type": "array",
      "items": {
        "type": "object",
        "required": ["host", "guest"],
        "additionalProperties": false,
        "properties": {
          "host":    { "type": "string", "minLength": 1 },
          "guest":   { "type": "string", "pattern": "^/.+" },
          "mode":    { "type": "string", "enum": ["ro", "rw"], "default": "ro" },
          "options": { "type": "string" }
        }
      }
    },
    "hostTools": {
      "type": "array",
      "items": {
        "type": "object",
        "required": ["name", "windowsExe", "guestCommand"],
        "additionalProperties": false,
        "properties": {
          "name":         { "type": "string" },
          "windowsExe":   { "type": "string", "minLength": 1 },
          "guestCommand": { "type": "string", "pattern": "^[A-Za-z0-9._-]+$" },
          "smokeTest":    { "type": "string" }
        }
      }
    },
    "claudeSettings": {
      "type": "object",
      "additionalProperties": true,
      "properties": {
        "model":                        { "type": "string" },
        "defaultEffort":                { "type": "string", "enum": ["low", "medium", "high", "xhigh"] },
        "theme":                        { "type": "string", "enum": ["dark", "light", "system"] },
        "autoApproveReadOnlyBash":      { "type": "boolean" },
        "autoApproveProjectWrites":     { "type": "boolean" },
        "autoApproveBuildCommands":     { "type": "boolean" },
        "claudelk":                     { "type": "boolean" },
        "claudelkEvents": {
          "type": "array",
          "items": { "type": "string", "enum": ["Stop", "Notification", "PreToolUse", "SessionStart"] }
        },
        "alwaysThinkingEnabled":        { "type": "boolean" },
        "autoUpdatesChannel":           { "type": "string", "enum": ["stable", "latest"] },
        "disableBypassPermissionsMode": { "type": "boolean" },
        "cleanupPeriodDays":            { "type": "integer", "minimum": 0 },
        "tui":                          { "type": "string", "enum": ["fullscreen", "default"] },
        "defaultShell":                 { "type": "string", "enum": ["bash", "powershell"] },
        "editorMode":                   { "type": "string", "enum": ["normal", "vim"] },
        "outputStyle":                  { "type": "string" },
        "permissions": {
          "type": "object",
          "additionalProperties": false,
          "properties": {
            "additionalAllow":       { "type": "array", "items": { "type": "string" } },
            "additionalDeny":        { "type": "array", "items": { "type": "string" } },
            "additionalAsk":         { "type": "array", "items": { "type": "string" } },
            "additionalDirectories": { "type": "array", "items": { "type": "string" } },
            "defaultMode":           { "type": "string", "enum": ["default", "acceptEdits", "plan", "bypassPermissions"] }
          }
        }
      }
    },
    "claudeFile": {
      "type": "object",
      "required": ["mode"],
      "additionalProperties": false,
      "deprecated": true,
      "description": "Deprecated: use claudeShared.claudeMd. Still honored for back-compat (maps onto claudeShared.claudeMd); claudeShared wins when both are present.",
      "properties": {
        "mode": { "type": "string", "enum": ["host-copy", "caveman-lite", "custom-path"] },
        "path": { "type": "string", "minLength": 1 }
      },
      "allOf": [
        {
          "if":   { "properties": { "mode": { "const": "custom-path" } } },
          "then": { "required": ["path"] }
        }
      ]
    },
    "claudeShared": {
      "type": "object",
      "additionalProperties": false,
      "description": "Shared, group-writable account-level Claude store (CLAUDE.md + skills/ + agents/) symlinked into every project user's ~/.claude. Content is seeded from the host and editable in-distro (shared across all projects); reconcile manages only the store structure, never overwriting content.",
      "properties": {
        "claudeMd": {
          "type": "object",
          "required": ["mode"],
          "additionalProperties": false,
          "description": "Seed source for the shared CLAUDE.md. 'skip' leaves it unmanaged.",
          "properties": {
            "mode": { "type": "string", "enum": ["host-copy", "caveman-lite", "custom-path", "skip"] },
            "path": { "type": "string", "minLength": 1 }
          },
          "allOf": [
            {
              "if":   { "properties": { "mode": { "const": "custom-path" } } },
              "then": { "required": ["path"] }
            }
          ]
        },
        "importSkills": { "type": "boolean", "default": true, "description": "Import %USERPROFILE%\\.claude\\skills into the store at setup / on `claude-shared import`." },
        "importAgents": { "type": "boolean", "default": true, "description": "Import %USERPROFILE%\\.claude\\agents into the store at setup / on `claude-shared import`." },
        "skillsPath":   { "type": "string", "minLength": 1, "description": "Override host source dir for skills (default %USERPROFILE%\\.claude\\skills)." },
        "agentsPath":   { "type": "string", "minLength": 1, "description": "Override host source dir for agents (default %USERPROFILE%\\.claude\\agents)." },
        "backup": {
          "type": "object",
          "additionalProperties": false,
          "description": "Host-side snapshots of the store taken before nuke and restorable on setup.",
          "properties": {
            "onNuke":        { "type": "boolean", "default": true,  "description": "Snapshot the store to %LOCALAPPDATA%\\claudearium\\backups\\<distro> before nuke." },
            "retain":        { "type": "integer", "minimum": 0, "default": 5, "description": "Keep the newest N snapshots (0 = unlimited)." },
            "restorePrompt": { "type": "boolean", "default": true,  "description": "Prompt to restore the newest snapshot during setup when one exists." }
          }
        }
      }
    }
  }
}
